{
  "meta": {
    "diagram_id": "pid-hybrid-images__train__404",
    "diagram_type": "PID",
    "source_file": "images__train__404.jpg",
    "image_width": 2048,
    "image_height": 1303,
    "parse_confidence": 0.72,
    "parser": "yolo+claude",
    "topology": "set_of_marks",
    "warnings": [],
    "title": "SYNTHETIC PROCESS FLOW DIAGRAM - SYNTHETIC PROCESS ENGINEERING FLOW SCHEME",
    "drawing_number": "20448719"
  },
  "spaces": [],
  "walls": [],
  "fixtures": [],
  "nodes": [
    {
      "id": "node-1",
      "type": "unknown",
      "sub_type": "unknown.box.niso",
      "tag": "unknown-1",
      "attributes": {},
      "bbox_2d": [
        0.11082,
        0.11222,
        0.0136,
        0.01731
      ],
      "confidence": 0.604
    },
    {
      "id": "node-2",
      "type": "fitting",
      "sub_type": "fitting.primary_accessible_dcs.iso",
      "tag": "GU-7216",
      "attributes": {},
      "bbox_2d": [
        0.11154,
        0.11144,
        0.01624,
        0.02554
      ],
      "confidence": 0.651
    },
    {
      "id": "node-3",
      "type": "fitting",
      "sub_type": "fitting.closed_fig8_blind.pip",
      "tag": "fitting-3",
      "attributes": {},
      "bbox_2d": [
        0.14423,
        0.10886,
        0.00791,
        0.02656
      ],
      "confidence": 0.372
    },
    {
      "id": "node-4",
      "type": "valve",
      "sub_type": "valve.general.iso",
      "tag": "valve-4",
      "attributes": {},
      "bbox_2d": [
        0.22858,
        0.11384,
        0.0128,
        0.01239
      ],
      "confidence": 0.454
    },
    {
      "id": "node-5",
      "type": "unknown",
      "sub_type": "piping_insulation.niso",
      "tag": "INS-5",
      "attributes": {},
      "bbox_2d": [
        0.26973,
        0.1126,
        0.02204,
        0.01233
      ],
      "confidence": 0.92
    },
    {
      "id": "node-6",
      "type": "instrument",
      "sub_type": "instrument.field_discrete.iso",
      "tag": "GH-82336",
      "attributes": {},
      "bbox_2d": [
        0.30887,
        0.11228,
        0.01765,
        0.02724
      ],
      "confidence": 0.567
    },
    {
      "id": "node-7",
      "type": "fitting",
      "sub_type": "fitting.flange.iso",
      "tag": "flange-7",
      "attributes": {},
      "bbox_2d": [
        0.42328,
        0.1128,
        0.00917,
        0.0146
      ],
      "confidence": 0.321
    },
    {
      "id": "node-8",
      "type": "fitting",
      "sub_type": "fitting.flange.iso",
      "tag": "flange-8",
      "attributes": {},
      "bbox_2d": [
        0.42683,
        0.11212,
        0.00887,
        0.01525
      ],
      "confidence": 0.461
    },
    {
      "id": "node-9",
      "type": "fitting",
      "sub_type": "fitting.flange.iso",
      "tag": "flange-9",
      "attributes": {},
      "bbox_2d": [
        0.14986,
        0.12418,
        0.00583,
        0.01145
      ],
      "confidence": 0.175
    },
    {
      "id": "node-10",
      "type": "fitting",
      "sub_type": "fitting.flange.iso",
      "tag": "flange-10",
      "attributes": {},
      "bbox_2d": [
        0.48852,
        0.12426,
        0.01064,
        0.01279
      ],
      "confidence": 0.224
    },
    {
      "id": "node-11",
      "type": "fitting",
      "sub_type": "fitting.flange.iso",
      "tag": "flange-11",
      "attributes": {},
      "bbox_2d": [
        0.4873,
        0.12831,
        0.00892,
        0.00668
      ],
      "confidence": 0.658
    },
    {
      "id": "node-12",
      "type": "fitting",
      "sub_type": "fitting.primary_accessible_dcs.iso",
      "tag": "fitting-12",
      "attributes": {},
      "bbox_2d": [
        0.4082,
        0.14233,
        0.01588,
        0.02584
      ],
      "confidence": 0.684
    },
    {
      "id": "node-13",
      "type": "unknown",
      "sub_type": "unknown.box.niso",
      "tag": "YU-5382",
      "attributes": {},
      "bbox_2d": [
        0.40834,
        0.14216,
        0.01616,
        0.02645
      ],
      "confidence": 0.709
    },
    {
      "id": "node-14",
      "type": "fitting",
      "sub_type": "fitting.flange.iso",
      "tag": "flange-14",
      "attributes": {},
      "bbox_2d": [
        0.46681,
        0.17468,
        0.00573,
        0.01535
      ],
      "confidence": 0.794
    },
    {
      "id": "node-15",
      "type": "unknown",
      "sub_type": "unknown.box.niso",
      "tag": "unknown-15",
      "attributes": {},
      "bbox_2d": [
        0.54539,
        0.17485,
        0.01151,
        0.01582
      ],
      "confidence": 0.658
    },
    {
      "id": "node-16",
      "type": "instrument",
      "sub_type": "instrument.field_discrete.iso",
      "tag": "instrument-16",
      "attributes": {},
      "bbox_2d": [
        0.621,
        0.17465,
        0.00799,
        0.02395
      ],
      "confidence": 0.718
    },
    {
      "id": "node-17",
      "type": "instrument",
      "sub_type": "instrument.field_discrete.iso",
      "tag": "instrument-17",
      "attributes": {},
      "bbox_2d": [
        0.62663,
        0.1747,
        0.01691,
        0.02734
      ],
      "confidence": 0.74
    },
    {
      "id": "node-18",
      "type": "unknown",
      "sub_type": "unknown.box.niso",
      "tag": "unknown-18",
      "attributes": {},
      "bbox_2d": [
        0.57775,
        0.18206,
        0.00785,
        0.02445
      ],
      "confidence": 0.294
    },
    {
      "id": "node-19",
      "type": "fitting",
      "sub_type": "fitting.closed_fig8_blind.pip",
      "tag": "fitting-19",
      "attributes": {},
      "bbox_2d": [
        0.57913,
        0.18198,
        0.00646,
        0.02398
      ],
      "confidence": 0.235
    },
    {
      "id": "node-20",
      "type": "fitting",
      "sub_type": "fitting.flange.iso",
      "tag": "flange-20",
      "attributes": {},
      "bbox_2d": [
        0.66674,
        0.17511,
        0.00636,
        0.01527
      ],
      "confidence": 0.426
    },
    {
      "id": "node-21",
      "type": "valve",
      "sub_type": "valve.general_nc.iso",
      "tag": "UV-4528",
      "attributes": {},
      "bbox_2d": [
        0.60735,
        0.20176,
        0.00758,
        0.02012
      ],
      "confidence": 0.265
    },
    {
      "id": "node-22",
      "type": "unknown",
      "sub_type": "unknown.box.niso",
      "tag": "AB-30404",
      "attributes": {},
      "bbox_2d": [
        0.36726,
        0.20627,
        0.01537,
        0.01684
      ],
      "confidence": 0.505
    },
    {
      "id": "node-23",
      "type": "valve",
      "sub_type": "valve.ball.niso",
      "tag": "valve-23",
      "attributes": {},
      "bbox_2d": [
        0.36904,
        0.21098,
        0.01191,
        0.0103
      ],
      "confidence": 0.185
    },
    {
      "id": "node-24",
      "type": "valve",
      "sub_type": "valve.general.iso",
      "tag": "valve-24",
      "attributes": {},
      "bbox_2d": [
        0.30238,
        0.23929,
        0.01419,
        0.01266
      ],
      "confidence": 0.152
    },
    {
      "id": "node-25",
      "type": "instrument",
      "sub_type": "instrument.primary_accessible_discrete.iso",
      "tag": "instrument-25",
      "attributes": {},
      "bbox_2d": [
        0.42848,
        0.23824,
        0.01734,
        0.02772
      ],
      "confidence": 0.209
    },
    {
      "id": "node-26",
      "type": "instrument",
      "sub_type": "instrument.field_discrete.iso",
      "tag": "instrument-26",
      "attributes": {},
      "bbox_2d": [
        0.42857,
        0.23842,
        0.01718,
        0.02739
      ],
      "confidence": 0.447
    },
    {
      "id": "node-27",
      "type": "unknown",
      "sub_type": "unknown.box.niso",
      "tag": "unknown-27",
      "attributes": {},
      "bbox_2d": [
        0.50888,
        0.23765,
        0.01718,
        0.02808
      ],
      "confidence": 0.75
    },
    {
      "id": "node-28",
      "type": "fitting",
      "sub_type": "fitting.primary_accessible_dcs.iso",
      "tag": "fitting-28",
      "attributes": {},
      "bbox_2d": [
        0.50923,
        0.23723,
        0.017,
        0.02581
      ],
      "confidence": 0.361
    },
    {
      "id": "node-29",
      "type": "unknown",
      "sub_type": "unknown.box.niso",
      "tag": "unknown-29",
      "attributes": {},
      "bbox_2d": [
        0.54673,
        0.23798,
        0.01516,
        0.0217
      ],
      "confidence": 0.907
    },
    {
      "id": "node-30",
      "type": "fitting",
      "sub_type": "fitting.flange.iso",
      "tag": "flange-30",
      "attributes": {},
      "bbox_2d": [
        0.66682,
        0.23814,
        0.00528,
        0.01397
      ],
      "confidence": 0.461
    },
    {
      "id": "node-31",
      "type": "unknown",
      "sub_type": "unknown.box.niso",
      "tag": "KZ-8367",
      "attributes": {},
      "bbox_2d": [
        0.70528,
        0.23525,
        0.01667,
        0.02665
      ],
      "confidence": 0.383
    },
    {
      "id": "node-32",
      "type": "fitting",
      "sub_type": "fitting.primary_accessible_dcs.iso",
      "tag": "fitting-32",
      "attributes": {},
      "bbox_2d": [
        0.7059,
        0.23702,
        0.01757,
        0.02933
      ],
      "confidence": 0.34
    },
    {
      "id": "node-33",
      "type": "fitting",
      "sub_type": "fitting.closed_fig8_blind.pip",
      "tag": "fitting-33",
      "attributes": {},
      "bbox_2d": [
        0.34157,
        0.2474,
        0.00614,
        0.03112
      ],
      "confidence": 0.247
    },
    {
      "id": "node-34",
      "type": "valve",
      "sub_type": "valve.butterfly.pip",
      "tag": "valve-34",
      "attributes": {},
      "bbox_2d": [
        0.60695,
        0.2774,
        0.00739,
        0.01858
      ],
      "confidence": 0.166
    },
    {
      "id": "node-35",
      "type": "valve",
      "sub_type": "valve.ball.niso",
      "tag": "AB-3243",